{
  "format": "classes-mathalea/1",
  "exporteLe": "2026-10-16T08:00:00.000Z",
  "classes": [
    {
      "nom": "5e A",
      "parcours": [
        {
          "id": "relatifs-5e",
          "version": 1,
          "titre": "Nombres relatifs",
          "objectif": "Additionner et soustraire des nombres relatifs sans hésiter.",
          "niveau": "5e",
          "theme": "Nombres relatifs",
          "difficulte": 1,
          "icone": "bx-calculator",
          "presentation": "liste_exos",
          "correction": "page",
          "enTetesMasques": true,
          "melanger": true,
          "etapes": [
            {
              "uuid": "cbc26",
              "id": "5N2G",
              "nbQuestions": 3,
              "titre": "Additionner deux relatifs"
            },
            {
              "uuid": "b6982",
              "id": "5N2I",
              "nbQuestions": 3,
              "titre": "Soustraire deux relatifs"
            }
          ]
        },
        {
          "id": "relatifs-ceintures-5e",
          "version": 2,
          "titre": "Relatifs en ceintures",
          "objectif": "Gagner les ceintures blanche, jaune et orange des relatifs.",
          "niveau": "5e",
          "theme": "Nombres relatifs",
          "difficulte": 2,
          "icone": "bx-target-lock",
          "presentation": "une_question_par_page",
          "correction": "question",
          "etapes": [
            {
              "uuid": "cbc26",
              "id": "5N2G",
              "nbQuestions": 2,
              "titre": "Additionner deux relatifs",
              "objectifs": [
                "Additionner deux nombres relatifs"
              ]
            },
            {
              "uuid": "b6982",
              "id": "5N2I",
              "nbQuestions": 2,
              "titre": "Soustraire deux relatifs",
              "objectifs": [
                "Soustraire deux nombres relatifs"
              ]
            },
            {
              "uuid": "36e2a",
              "id": "5N2H",
              "nbQuestions": 2,
              "titre": "Additionner 5 nombres relatifs",
              "titreMasque": true
            }
          ],
          "style": "ceintures",
          "premiereCeinture": 0,
          "paliers": [
            {
              "titre": "Additionner",
              "nb": 1,
              "pause": {
                "texte": "Bravo ! Avant de soustraire, relis la règle des signes."
              }
            },
            {
              "titre": "Soustraire",
              "nb": 1,
              "acces": "seuil",
              "seuil": 80,
              "ressource": {
                "titre": "Fiche : soustraire un relatif",
                "lien": "https://example.org/fiche-soustraction.pdf"
              }
            },
            {
              "titre": "Enchaîner",
              "nb": 1,
              "acces": "libre"
            }
          ]
        }
      ]
    }
  ],
  "banque": true,
  "bibliotheque": {
    "parcours": [
      {
        "id": "fractions-4e",
        "version": 1,
        "titre": "Fractions",
        "objectif": "Simplifier, additionner et multiplier des fractions.",
        "niveau": "4e",
        "theme": "Fractions",
        "difficulte": 2,
        "icone": "bx-calculator",
        "presentation": "une_question_par_page",
        "correction": "parcours",
        "etapes": [
          {
            "uuid": "f8f4e",
            "id": "5N13",
            "nbQuestions": 3,
            "titre": "Simplifier une fraction"
          },
          {
            "uuid": "5f429",
            "id": "4C21",
            "nbQuestions": 3,
            "titre": "Additionner des fractions"
          }
        ]
      }
    ],
    "objectifs": [
      {
        "libelle": "Additionner deux nombres relatifs",
        "niveau": "5e",
        "theme": "Nombres relatifs",
        "code": "5N2G"
      },
      {
        "libelle": "Soustraire deux nombres relatifs",
        "niveau": "5e",
        "theme": "Nombres relatifs"
      }
    ]
  }
}
